Text in Context,1
The Countess of Huntingdon's Connexion,1
The Early Development of Canon Law and the Council of Serdica,1
The Orthodox Church in the Byzantine Empire,1
The School Tradition of the Old Testament,1
Communities and Markets in Economic Development,1
Economic Organizations and Corporate Governance in Japan,2
Finite Sample Econometrics,1
Inequality Growth and Poverty in an Era of Liberalization and Globalization,1
International Migration,1
Management Accounting in the Digital Economy,1
Monetary Unions and Hard Pegs,1
Network Epidemiology,2
Pension Security in the 21st Century,1
Periodic Time Series Models,1
The Glitter of Gold,3
The Japanese Main Bank System,1
The Pension Challenge,1
Trade and Jobs in Europe,1
Evidentialism,2
Facing Death,1
Manifest Activity,1
Pleasure and the Good Life,1
Problems of Rationality,1
Renewing Meaning,1
Why there is Something rather than Nothing,1
The Black Sea,1
The International Criminal Tribunal for the Former Yugoslavia,1
The Northern Ireland Conflict,1
Ambrose: De Officiis,2
The Economy of Esteem,1
In Defense of Sentimentality,1
Minimal Semantics,1
Realistic Decision Theory,1
Reflecting the Mind,1
Cold War Statesmen Confront the Bomb,1
Democracy and Public Management Reform,1
Democracy Beyond Borders,1
Political Choice in Britain,1
Social Mobility in Europe,1
The Future of the Welfare State,1
The National Co-ordination of EU Policy,1
Gregory of Nyssa and the Grasp of Faith,1
Paul,4
The Suffering of the Impassible God,1
Competing in the Information Age,1
Foundations of Human Sociality,1
Halting Degradation of Natural Resources,1
Happiness Quantified,1
Inequality and the State,1
Insurance Against Poverty,1
Models for Dynamic Macroeconomics,1
New Sources of Development Finance,1
Peasants versus City-Dwellers,1
Pension Design and Structure,1
Text in Context,1
The Countess of Huntingdon's Connexion,1
The Early Development of Canon Law and the Council of Serdica,1
The Orthodox Church in the Byzantine Empire,1
The School Tradition of the Old Testament,1
Communities and Markets in Economic Development,1
Economic Organizations and Corporate Governance in Japan,1
Finite Sample Econometrics,1
Inequality Growth and Poverty in an Era of Liberalization and Globalization,1
International Migration,1
Management Accounting in the Digital Economy,1
Monetary Unions and Hard Pegs,1
Network Epidemiology,1
